{
  "$schema": "https://json-schema.org/draft/2020-12/schema",
  "title": "Peek-Then-Pay Read Intent Response",
  "description": "Canonical, transient full-content response for LLM/agent consumption.",
  "type": "object",
  "properties": {
    "intent": {
      "type": "string",
      "const": "read",
      "description": "Intent type identifier"
    },
    "canonicalUrl": { "type": "string", "format": "uri" },
    "language": {
      "type": "string",
      "description": "IETF BCP-47 tag, e.g., en or en-US. Use 'und' (undefined) for non-linguistic media like images/video/audio."
    },
    "contentType": {
      "$ref": "common-defs.schema.json#/$defs/contentType"
    },
    "mediaType": {
      "$ref": "common-defs.schema.json#/$defs/mediaType"
    },
    "content": {
      "description": "Primary body. If `application/json+ptp-structured`, see `structured`. Null for non-text media.",
      "type": ["string", "null"]
    },
    "structured": {
      "description": "Optional normalized structure; used when mediaType is application/json+ptp-structured. Either blocks or markdown will be present, controlled by ptp_format parameter.",
      "type": "object",
      "properties": {
        "title": {
          "type": "string",
          "description": "Document title."
        },
        "description": {
          "type": "string",
          "description": "Meta description or intro paragraph."
        },
        "author": {
          "description": "Author(s).",
          "oneOf": [
            { "type": "string" },
            {
              "type": "array",
              "items": {
                "type": "object",
                "properties": { "name": { "type": "string" } },
                "required": ["name"]
              }
            }
          ]
        },
        "datePublished": {
          "type": "string",
          "description": "ISO 8601 date."
        },
        "dateModified": {
          "type": "string",
          "description": "ISO 8601 date."
        },
        "metadata": {
          "$ref": "common-defs.schema.json#/$defs/pageMetadata",
          "description": "Extracted structured metadata (product, article, etc.)."
        },
        "blocks": {
          "type": "array",
          "description": "Structured blocks (when ptp_format=blocks).",
          "items": {
            "type": "object",
            "properties": {
              "type": {
                "type": "string",
                "enum": [
                  "heading",
                  "paragraph",
                  "list",
                  "quote",
                  "code",
                  "table",
                  "figure",
                  "callout",
                  "footnote",
                  "other"
                ]
              },
              "role": {
                "type": "string",
                "description": "Optional semantic hint, e.g., abstract, intro, methods, results."
              },
              "text": { "type": "string" },
              "attrs": { "type": "object", "additionalProperties": true },
              "assetRef": { "type": "string", "format": "uri" }
            },
            "required": ["type"]
          }
        },
        "markdown": {
          "type": "string",
          "description": "Markdown representation (when ptp_format=markdown, default)."
        }
      },
      "additionalProperties": false
    },
    "normalization": {
      "allOf": [
        { "$ref": "common-defs.schema.json#/$defs/baseNormalization" },
        {
          "description": "Describes cleaning/transformation applied.",
          "properties": {
            "adsRemoved": { "type": "boolean", "default": false }
          }
        }
      ]
    },
    "provenance": {
      "allOf": [
        { "$ref": "common-defs.schema.json#/$defs/baseProvenance" },
        {
          "properties": {
            "etag": { "type": "string" },
            "lastModified": { "type": "string", "format": "date-time" }
          }
        }
      ]
    },
    "length": {
      "allOf": [
        { "$ref": "common-defs.schema.json#/$defs/baseLength" },
        {
          "required": ["inputTokens", "outputTokens"]
        }
      ]
    },
    "assets": {
      "type": "array",
      "description": "Optional referenced assets (images, tables, attachments).",
      "items": {
        "type": "object",
        "properties": {
          "rel": { "type": "string", "enum": ["image", "table", "supplement", "other"] },
          "href": { "type": "string", "format": "uri" },
          "mime": { "type": "string" },
          "title": { "type": "string" },
          "alt": { "type": "string", "description": "Alt text for images." },
          "width": { "type": "integer", "minimum": 1, "description": "Image width in pixels." },
          "height": { "type": "integer", "minimum": 1, "description": "Image height in pixels." }
        },
        "required": ["rel", "href"]
      },
      "maxItems": 100
    }
  },
  "required": ["intent", "canonicalUrl", "mediaType", "provenance", "length"],
  "allOf": [
    {
      "if": {
        "properties": {
          "mediaType": {
            "pattern": "^(text/|application/(json|.*\\+json|.*\\+xml)|text/markdown|text/html)$"
          }
        }
      },
      "then": {
        "anyOf": [{ "required": ["content"] }, { "required": ["structured"] }],
        "properties": {
          "content": { "type": "string", "minLength": 1 }
        }
      }
    },
    {
      "if": {
        "properties": {
          "mediaType": {
            "pattern": "^(image/|audio/|video/|application/pdf|application/octet-stream)$"
          }
        }
      },
      "then": {
        "properties": { "content": { "type": "null" } },
        "required": ["assets"]
      }
    }
  ],
  "additionalProperties": false
}
